{
  "$schema": "http://json-schema.org/draft-04/schema#",
  "title": "MasterFile",
  "description": "Arquivo que descreve os dominios e classes de um modelo de banco de dados espaciais",
  "type": "object",
  "definitions": {
    "dominio": {
      "type": "object",
      "description": "Classes dominio armazenam pares code, value de forma a descrever valores utilizados nas classes. Não especificar 'a ser preenchido'",
      "properties": {
        "nome": { "type": "string" },
        "filtro": { "type": "boolean" },
        "valores": { 
          "type": "array",
          "items": {
            "type": "object",
            "properties": {
              "code": {
                "type": "integer",
                "description": "Código numérico do domínio"
              },
              "value": {
                "type": "string",
                "description": "Texto equivalente ao código numérico"
              },
              "descricao": {
                "type": "string",
                "default": "-",
                "description": "Descrição textual do código do domínio"
              },
              "valor_filtro": {
                "type": "string",
                "description": "Em caso do código pertencer a um grupo especificar o nome do grupo"
              }
            },
            "required": ["code", "value"],
            "additionalProperties": false
          },
          "minItems": 1
        }
      },
      "required": ["nome", "valores"],
      "additionalProperties": false
    },
    "atributo":{
      "type": "object",
      "description": "Atributo de uma classe. Não especificar chave primária e coluna geométrica",
      "properties": {
        "nome": {
          "type": "string",
          "description": "Nome do atributo"
        },
        "tipo": {
          "type": "string",
          "description": "Tipo do atributo no padrão do PostGreSQL"
        },
        "descricao": {
          "type": "string",
          "default": "-",
          "description": "Descrição textual de um atributo"
        },
        "cardinalidade": {
          "type": "string",
          "enum": ["0..1", "1..1", "0..*", "1..*"],
          "description": "Cardinalidade de uso do atributo"
        },
        "mapa_valor": {
          "type": "string",
          "description": "Caso seja um mapa de valor referenciar o nome do domínio"
        },
        "valores": {
          "oneOf": [
            {
              "type": "array",
              "items": {
                "type": "object",
                "properties": {
                  "code": { 
                    "type": "integer",
                    "description": "Código numérico do domínio"
                  },
                  "primitivas": {
                    "type": "array",
                    "description": "Lista de restrição para geometrias inválidas.",
                    "items": {
                      "type": "string",
                      "enum": ["MultiPoint", "MultiLinestring", "MultiPolygon"]
                    },
                    "minItems": 1,
                    "uniqueItems": true              
                  }
                },
                "required": ["code"],
                "additionalProperties": false
              },
              "minItems": 1
            },
            {
              "type": "array",
              "items": {
                "type": "integer"
              },
              "minItems": 1
            },
            {
              "type": "object",
              "properties": {
                "MultiPoint": {
                  "type": "array",
                  "items": {
                    "type": "integer"
                  },
                  "minItems": 1
                },
                "MultiLinestring": {
                  "type": "array",
                  "items": {
                    "type": "integer"
                  },
                  "minItems": 1
                },
                "MultiPolygon": {
                  "type": "array",
                  "items": {
                    "type": "integer"
                  },
                  "minItems": 1
                }
              },
              "additionalProperties": false
            }
          ]
        },
        "primitivas": {
          "type": "array",
          "description": "Lista de geometrias válidas para utilizar esse atributo.",
          "items": {
            "type": "string",
            "enum": ["MultiPoint", "MultiLinestring", "MultiPolygon"]
          },
          "minItems": 1,
          "uniqueItems": true
        }
      },
      "required": ["nome", "tipo", "cardinalidade"],
      "additionalProperties": false
    },
    "classe": {
      "type": "object",
      "description": "Classe espaciais",
      "properties": {
        "nome": {
          "type": "string",
          "description": "Nome da classe."
        },      
        "categoria": {
          "type": "string",
          "description": "Categoria da classe."
        },
        "descricao": {
          "type": "string",
          "description": "Descrição textual da classe.",
          "default": "-"
        },
        "primitivas": {
          "type": "array",
          "description": "Lista de geometrias válidas para a classe.",
          "items": {
            "type": "string",
            "enum": ["MultiPoint", "MultiLinestring", "MultiPolygon"]
          },
          "minItems": 1,
          "uniqueItems": true
        },
        "atributos": {
          "type": "array",
          "description": "Lista de atributos da classe",
          "items": { "$ref": "#/definitions/atributo" }
        }
      },
      "required": ["nome", "categoria", "primitivas", "atributos"],
      "additionalProperties": false      
    }
  },
  "properties": {
    "modelo": {
      "description": "Nome do modelo de dados",
      "type": "string"
    },
    "comentario": {
      "description": "Comentário sobre o modelo de dados",
      "type": "string"
    },
    "versao": {
      "description": "Versão do modelo, utilizando Semantic Versioning (https://semver.org/)",
      "type": "string"
    },
    "coord_sys": {
      "description": "Código EPSG",
      "type": "integer"
    },
    "a_ser_preenchido": {
      "description": "Indicia se será gerado um valor nos domínios para 'a ser preenchido'",
      "type": "object",
      "properties": {
        "code": { "type": "integer" },
        "value": { "type": "string" }    
      },
      "required": ["code", "value"]
    },
    "schema_dados":{
      "description": "Nome do schema que contém as classes espaciais no banco de dados",
      "type": "string",      
      "default": "edgv"
    },
    "schema_dominios":{
      "description": "Nome do schema que contém os dominios no banco de dados",
      "type": "string",      
      "default": "dominios"
    },
    "fill_factor":{
      "description": "Valor para o fill factor das tabelas criadas no banco de dados",
      "type": "integer", 
      "minimum": 0,
      "maximum": 100,     
      "default": 80
    },
    "nome_geom":{
      "description": "Nome da coluna geométrica no banco de dados",
      "type": "string",      
      "default": "geom"
    },
    "nome_id":{
      "description": "Nome da coluna de chave primária serial no banco de dados",
      "type": "string",      
      "default": "id"
    },
    "atributos_padrao": {
      "type": "array",
      "items": { "$ref": "#/definitions/atributo" },
      "minItems": 1
    },
    "geom_suffix":{
      "description": "Sufixo aplicado as classes espaciais para indicar o tipo de geometria",
      "type": "object",
      "properties": {
        "MultiPoint": {
          "type": "string",      
          "default": "_p"          
        },
        "MultiLinestring": {
          "type": "string",      
          "default": "_l"              
        },
        "MultiPolygon": {
          "type": "string",      
          "default": "_a"              
        }     
      },
      "additionalProperties": false
    },
    "geom_prefix":{
      "description": "Prefixo aplicado as classes espaciais para indicar o tipo de geometria",
      "type": "object",
      "properties": {
        "MultiPoint": {
          "type": "string",      
          "default": "p"          
        },
        "MultiLinestring": {
          "type": "string",      
          "default": "l"              
        },
        "MultiPolygon": {
          "type": "string",      
          "default": "a"              
        }     
      },
      "additionalProperties": false
    },
    "dominios": {
      "type": "array",
      "items": { "$ref": "#/definitions/dominio" }
    },
    "classes": {
      "type": "array",
      "items": { "$ref": "#/definitions/classe" },
      "minItems": 1
    },
    "extension_classes": {
      "type": "array",
      "items": { "$ref": "#/definitions/classe" },
      "minItems": 1
    }
  },
  "additionalProperties": false,
  "required": ["modelo", "versao", "coord_sys", "classes"]
}