{
  "modelo": "EDGV 2.1.3 Topo",
  "versao": "5.4.1",
  "schema_dados": "edgv",
  "schema_dominios": "dominios",
  "a_ser_preenchido": {
    "code": 999,
    "value": "A SER PREENCHIDO"
  },
  "atributos_padrao": [
    {
      "nome": "tipo_comprovacao",
      "tipo": "smallint",
      "mapa_valor": "tipo_comprovacao",
      "descricao": "-",
      "cardinalidade": "1..1",
      "valores": [
        {
          "code": 1
        },
        {
          "code": 2
        },
        {
          "code": 3
        }
      ]
    },
    {
      "nome": "tipo_insumo",
      "tipo": "smallint",
      "mapa_valor": "tipo_insumo",
      "descricao": "-",
      "cardinalidade": "1..1",
      "valores": [
        {
          "code": 1
        },
        {
          "code": 2
        },
        {
          "code": 3
        },
        {
          "code": 4
        },
        {
          "code": 5
        }
      ]
    },
    {
      "nome": "observacao",
      "tipo": "VARCHAR(255)",
      "descricao": "-",
      "cardinalidade": "0..1"
    },
    {
      "nome": "data_modificacao",
      "tipo": "timestamp with time zone",
      "descricao": "-",
      "cardinalidade": "0..1"
    },
    {
      "nome": "controle_id",
      "tipo": "uuid",
      "descricao": "-",
      "cardinalidade": "0..1"
    },
    {
      "nome": "ultimo_usuario",
      "tipo": "VARCHAR(255)",
      "descricao": "-",
      "cardinalidade": "0..1"
    }
  ],
  "coord_sys": 31982,
  "fill_factor": 80,
  "nome_geom": "geom",
  "nome_id": "id",
  "geom_suffix": {
    "MultiPoint": "_p",
    "MultiLinestring": "_l",
    "MultiPolygon": "_a"
  },
  "dominios": [
    {
      "nome": "tipo_comprovacao",
      "valores": [
        {
          "code": 1,
          "value": "Confirmado em campo",
          "descricao": "-"
        },
        {
          "code": 2,
          "value": "Não possível de confirmar em campo",
          "descricao": "-"
        },
        {
          "code": 3,
          "value": "Feição não necessita de confirmação",
          "descricao": "-"
        }
      ]
    },
    {
      "nome": "tipo_insumo",
      "valores": [
        {
          "code": 1,
          "value": "Fotointerpretado",
          "descricao": "-"
        },
        {
          "code": 2,
          "value": "Insumo externo",
          "descricao": "-"
        },
        {
          "code": 3,
          "value": "Processo automático",
          "descricao": "-"
        },
        {
          "code": 4,
          "value": "Aquisição em campo",
          "descricao": "-"
        },
        {
          "code": 5,
          "value": "Mapeamento anterior",
          "descricao": "-"
        }
      ]
    },
    {
      "nome": "administracao",
      "valores": [
        {
          "code": 0,
          "value": "Desconhecida",
          "descricao": "-"
        },
        {
          "code": 1,
          "value": "Federal",
          "descricao": "-"
        },
        {
          "code": 2,
          "value": "Estadual",
          "descricao": "-"
        },
        {
          "code": 3,
          "value": "Municipal",
          "descricao": "-"
        },
        {
          "code": 6,
          "value": "Particular",
          "descricao": "-"
        },
        {
          "code": 7,
          "value": "Concessionada",
          "descricao": "-"
        },
        {
          "code": 97,
          "value": "Não aplicável",
          "descricao": "-"
        }
      ]
    },
    {
      "nome": "booleano",
      "valores": [
        {
          "code": 1,
          "value": "Sim",
          "descricao": "-"
        },
        {
          "code": 2,
          "value": "Não",
          "descricao": "-"
        }
      ]
    },
    {
      "nome": "booleano_estendido",
      "valores": [
        {
          "code": 0,
          "value": "Desconhecido",
          "descricao": "-"
        },
        {
          "code": 1,
          "value": "Sim",
          "descricao": "-"
        },
        {
          "code": 2,
          "value": "Não",
          "descricao": "-"
        }
      ]
    },
    {
      "nome": "canteiro_divisorio",
      "valores": [
        {
          "code": 1,
          "value": "Sim",
          "descricao": "-"
        },
        {
          "code": 2,
          "value": "Não",
          "descricao": "-"
        }
      ]
    },
    {
      "nome": "finalidade",
      "valores": [
        {
          "code": 0,
          "value": "Desconhecida",
          "descricao": "-"
        },
        {
          "code": 2,
          "value": "Tratamento",
          "descricao": "-"
        },
        {
          "code": 3,
          "value": "Recalque",
          "descricao": "-"
        },
        {
          "code": 4,
          "value": "Distribuição",
          "descricao": "-"
        },
        {
          "code": 8,
          "value": "Armazenamento",
          "descricao": "-"
        }
      ]
    },
    {
      "nome": "forma_extracao",
      "valores": [
        {
          "code": 5,
          "value": "A céu aberto",
          "descricao": "-"
        },
        {
          "code": 6,
          "value": "Subterrânea",
          "descricao": "-"
        }
      ]
    },
    {
      "nome": "indice",
      "valores": [
        {
          "code": 1,
          "value": "Mestra",
          "descricao": "Curva múltipla do quíntuplo da equidistância empregada, sendo a primeira, a relativa ao nível de referência, de altitude igual a zero."
        },
        {
          "code": 2,
          "value": "Normal",
          "descricao": "Curva traçada no intervalo das curvas de nível mestras, sendo múltipla da equidistância empregada."
        },
        {
          "code": 3,
          "value": "Auxiliar",
          "descricao": "Curva traçada com o valor adicional de meia equidistância, com o intuito de melhor representar o relevo."
        }
      ]
    },
    {
      "nome": "jurisdicao",
      "valores": [
        {
          "code": 0,
          "value": "Desconhecida",
          "descricao": "-"
        },
        {
          "code": 1,
          "value": "Federal",
          "descricao": "-"
        },
        {
          "code": 2,
          "value": "Estadual",
          "descricao": "-"
        },
        {
          "code": 3,
          "value": "Municipal",
          "descricao": "-"
        },
        {
          "code": 6,
          "value": "Particular",
          "descricao": "-"
        },
        {
          "code": 97,
          "value": "Não aplicável",
          "descricao": "-"
        }
      ]
    },
    {
      "nome": "material_construcao",
      "valores": [
        {
          "code": 0,
          "value": "Desconhecido",
          "descricao": "-"
        },
        {
          "code": 1,
          "value": "Alvenaria",
          "descricao": "-"
        },
        {
          "code": 2,
          "value": "Concreto",
          "descricao": "-"
        },
        {
          "code": 3,
          "value": "Metal",
          "descricao": "-"
        },
        {
          "code": 4,
          "value": "Rocha",
          "descricao": "-"
        },
        {
          "code": 5,
          "value": "Madeira",
          "descricao": "-"
        },
        {
          "code": 6,
          "value": "Arame",
          "descricao": "-"
        },
        {
          "code": 7,
          "value": "Tela ou alambrado",
          "descricao": "-"
        },
        {
          "code": 8,
          "value": "Cerca viva",
          "descricao": "-"
        },
        {
          "code": 23,
          "value": "Terra",
          "descricao": "-"
        },
        {
          "code": 97,
          "value": "Não aplicável",
          "descricao": "-"
        },
        {
          "code": 98,
          "value": "Outros",
          "descricao": "-"
        }
      ]
    },
    {
      "nome": "modal_uso",
      "valores": [
        {
          "code": 4,
          "value": "Rodoviário",
          "descricao": "-"
        },
        {
          "code": 5,
          "value": "Ferroviário",
          "descricao": "-"
        },
        {
          "code": 6,
          "value": "Metroviário",
          "descricao": "-"
        },
        {
          "code": 8,
          "value": "Rodoferroviário",
          "descricao": "-"
        },
        {
          "code": 9,
          "value": "Aeroportuário",
          "descricao": "-"
        }
      ]
    },
    {
      "nome": "nr_linhas",
      "valores": [
        {
          "code": 0,
          "value": "Desconhecido",
          "descricao": "-"
        },
        {
          "code": 1,
          "value": "Simples",
          "descricao": "-"
        },
        {
          "code": 2,
          "value": "Dupla",
          "descricao": "-"
        },
        {
          "code": 3,
          "value": "Múltipla",
          "descricao": "-"
        }
      ]
    },
    {
      "nome": "posicao_pista",
      "valores": [
        {
          "code": 12,
          "value": "Adjacentes",
          "descricao": "-"
        },
        {
          "code": 13,
          "value": "Superpostas",
          "descricao": "-"
        },
        {
          "code": 97,
          "value": "Não aplicável",
          "descricao": "-"
        }
      ]
    },
    {
      "nome": "posicao_relativa",
      "valores": [
        {
          "code": 2,
          "value": "Superfície",
          "descricao": "-"
        },
        {
          "code": 3,
          "value": "Elevado",
          "descricao": "-"
        },
        {
          "code": 4,
          "value": "Emerso",
          "descricao": "-"
        },
        {
          "code": 5,
          "value": "Submerso",
          "descricao": "-"
        },
        {
          "code": 6,
          "value": "Subterrâneo",
          "descricao": "-"
        },
        {
          "code": 14,
          "value": "Isolada",
          "descricao": "-"
        },
        {